 Stroller,  Sunglass,  Tent,  Router,  Gloves,  Blender,  Shoe,  Band-aid,  Coffee,  Wallet,  Mobile, Sanitizer,  Masks
 Wallet,  Band-aid,  Watch,  Router, Diapers
 Biscuits,  Pillow,  Watch,  Printer,  Wallet,  Bottle, T-Shirt,  Cutlery, Flashlight,  Tent,  Band-aid, Diapers,  Coffee
 Mobile, Headphone,  Wallet,  Blanket,  Masks,  Blender,  Gloves, Diapers,  Tent
 Oximeter, T-Shirt,  Shampoo,  Stroller,  Shoe
Toaster,  Masks, Diapers,  Wallet,  Tent
 Tent,  Router, Diapers,  Backpack, T-Shirt,  Sunglass,  Biscuits, Toaster,  Gloves,  Oximeter
 Shampoo,  Stroller,  Tent,  Toys, Sanitizer, Headphone,  Shoe,  Watch,  Sunglass,  Gloves
Sanitizer, T-Shirt,  Watch,  Blender,  Coffee, Toaster,  Blanket,  Shampoo,  Oximeter,  Pillow,  Bottle,  Shoe,  Backpack
 Cutlery,  Wallet,  Watch, Sanitizer,  Oximeter
 Laptop,  Bottle,  Toys,  Shoe,  Printer,  Watch
 Stroller,  Watch,  Shampoo,  Biscuits,  Oximeter,  Shoe,  Tent,  Masks,  Toys,  Bottle, Sanitizer
 Watch,  Band-aid, Diapers, Flashlight,  Router,  Laptop,  Coffee,  Wallet,  Printer
T-Shirt, Toaster, Flashlight,  Mobile,  Laptop,  Printer,  Biscuits,  Stroller,  Coffee,  Shampoo
Toaster, Diapers,  Biscuits,  Shampoo,  Laptop,  Tent,  Sunglass,  Blender,  Band-aid,  Wallet,  Oximeter,  Watch,  Backpack
Headphone,  Blender,  Tent, Flashlight,  Shoe,  Band-aid,  Cutlery, Sanitizer,  Sunglass
 Wallet,  Printer,  Blender,  Masks,  Toys
 Printer, Diapers,  Gloves,  Cutlery, Toaster,  Mobile,  Toys,  Wallet, Sanitizer, T-Shirt,  Backpack,  Oximeter,  Router,  Blender,  Band-aid
 Gloves,  Blender,  Sunglass, T-Shirt,  Oximeter,  Tent,  Biscuits,  Wallet, Toaster,  Mobile,  Cutlery,  Laptop, Flashlight,  Printer
 Shoe,  Oximeter,  Printer,  Blanket, T-Shirt,  Pillow,  Blender
